{
  "schema_version": "1.0",
  "app_id": "xero",
  "researched_at": "2026-07-13T13:05:31Z",
  "research_run": {
    "agent": "initial_research_agent",
    "model": "deepseek-v4-flash",
    "tools": [
      "COMPOSIO_SEARCH_FETCH_URL_CONTENT",
      "COMPOSIO_SEARCH_TAVILY",
      "submit_app_research"
    ],
    "tool_calls": 13,
    "trace_path": "logs/xero-trace.jsonl"
  },
  "findings": {
    "classification": {
      "researched_category": {
        "value": "Accounting and Finance",
        "evidence_ids": [
          "s1",
          "s9"
        ],
        "notes": "Xero is a cloud-based accounting platform for small to medium businesses. It provides APIs for accounting, payroll, assets, projects, files, and bank feeds."
      },
      "one_liner": {
        "value": "Cloud accounting platform for small to medium businesses that offers REST APIs for invoices, contacts, bank transactions, payroll, reporting, and more.",
        "evidence_ids": [
          "s1",
          "s9"
        ],
        "notes": "Xero's product page and developer portal confirm it as an online accounting and bookkeeping platform."
      }
    },
    "authentication": {
      "methods": {
        "value": [
          "oauth2",
          "bearer_token",
          "custom"
        ],
        "evidence_ids": [
          "s2",
          "s3",
          "s4"
        ],
        "notes": "Xero primarily uses OAuth 2.0 (authorization code flow, PKCE, and client credentials / Custom Connections). Bearer tokens are also supported for the MCP server. The token types page details access tokens (JWT), refresh tokens, and ID tokens."
      },
      "primary_for_agent_toolkit": "oauth2"
    },
    "access": {
      "credential_access": "self_serve_free",
      "gates": [
        "account_signup"
      ],
      "signup_friction": "none_observed",
      "paid_plan_required_for_api": "plan_dependent",
      "admin_approval_required": "no",
      "evidence_ids": [
        "s6",
        "s8",
        "s9"
      ],
      "notes": "The developer account signup is free. There is a free Starter tier (up to 5 connections, 1,000 API calls/day) and paid tiers (Core, Plus, Advanced, Enterprise) for higher usage. No credit card is required for Starter. The development account page says 'Signing up for a Xero account is free'. The AI Toolkit and MCP server are available on the Starter tier."
    },
    "api_surface": {
      "public_api": "yes",
      "protocols": [
        "rest",
        "webhooks"
      ],
      "breadth": "broad",
      "summary": {
        "value": "Xero offers a comprehensive set of public REST APIs: Accounting API (invoices, contacts, bank transactions, reports, journals, etc.), Payroll API (AU, NZ, UK regions), Assets API, Projects API, Files API, and BankFeeds API. Also supports webhooks. Official SDKs exist for Node.js, PHP, Ruby, .NET, Python, Java. The API Explorer and OpenAPI specs are publicly available.",
        "evidence_ids": [
          "s5",
          "s7",
          "s9"
        ],
        "notes": "The Accounting API alone covers 30+ resource types. The developer portal lists extensive documentation for each API family."
      },
      "api_docs_url": "https://developer.xero.com/documentation/api/"
    },
    "agent_interface": {
      "mcp": "official",
      "mcp_endpoint": "https://github.com/xeroapi/xero-mcp-server",
      "existing_agent_skills": [
        "official_sdk",
        "official_cli",
        "composio_toolkit"
      ],
      "evidence_ids": [
        "s4",
        "s5",
        "s6",
        "s10"
      ],
      "notes": "Xero has an official MCP server published by XeroAPI on GitHub and npm (@xeroapi/xero-mcp-server). It also has an 'AI Toolkit' with examples for OpenAI Agents SDK, LangChain, and a CLI tool. The MCP server is listed on the Xero Developer pricing page as available on the free Starter tier."
    },
    "buildability": {
      "verdict": "buildable_today",
      "main_blocker": "none_material",
      "rationale": {
        "value": "Xero has a well-documented public REST API, OAuth 2.0 authentication, a free developer tier (Starter) with 5 connections and 1,000 API calls/day, an official MCP server, SDKs for multiple languages, and an AI agent toolkit. A developer can sign up for free, create an app, get API credentials, and build an agent integration today. The main consideration is that scaling beyond 5 connected organizations requires a paid tier.",
        "evidence_ids": [
          "s6",
          "s8",
          "s4",
          "s9",
          "s10"
        ],
        "notes": "The only potential limitation is the 5-connection cap on the free Starter tier and 1,000 API calls/day rate limit, but these are sufficient for development and testing."
      }
    }
  },
  "sources": {
    "s1": {
      "url": "https://developer.xero.com",
      "quote": "Xero Developer: Powering Your Innovation and Growth",
      "source_type": "official_product_page",
      "accessed_at": "2026-07-13T12:00:00Z",
      "title": "Xero Developer Platform"
    },
    "s2": {
      "url": "https://developer.xero.com/documentation/guides/oauth2/token-types",
      "quote": "Xero uses OAuth 2.0 for authentication. Access tokens are JWT, valid for 30 minutes. Refresh tokens valid for 60 days.",
      "source_type": "official_auth_docs",
      "accessed_at": "2026-07-13T12:00:00Z",
      "title": "Token types \u2014 Xero Developer"
    },
    "s3": {
      "url": "https://developer.xero.com/documentation/guides/oauth2/overview",
      "quote": "OAuth 2.0 is a protocol that lets your app access a user\u2019s account without accessing their password.",
      "source_type": "official_auth_docs",
      "accessed_at": "2026-07-13T12:00:00Z",
      "title": "OAuth 2.0 \u2014 Xero Developer"
    },
    "s4": {
      "url": "https://github.com/xeroapi/xero-mcp-server",
      "quote": "This is a Model Context Protocol (MCP) server implementation for Xero. It provides a bridge between the MCP protocol and Xero's API.",
      "source_type": "official_github",
      "accessed_at": "2026-07-13T12:00:00Z",
      "title": "XeroAPI/xero-mcp-server"
    },
    "s5": {
      "url": "https://github.com/XeroAPI/xero-agent-toolkit",
      "quote": "A collection of examples demonstrating how to build AI agents that integrate with the Xero API using various agentic frameworks and the Xero MCP Server.",
      "source_type": "official_github",
      "accessed_at": "2026-07-13T12:00:00Z",
      "title": "XeroAPI/xero-agent-toolkit"
    },
    "s6": {
      "url": "https://developer.xero.com/pricing",
      "quote": "Starter tier: No charge, max 5 connections, 1000 API calls per day per org. Includes AI toolkit (MCP server, Open AI Agentic SDKs, Prompt library).",
      "source_type": "official_pricing",
      "accessed_at": "2026-07-13T12:00:00Z",
      "title": "Pricing \u2014 Xero Developer"
    },
    "s7": {
      "url": "https://developer.xero.com/documentation/api/accounting/accounts",
      "quote": "Accounting API Accounts \u2014 RESTful endpoints for accounts, invoices, contacts, bank transactions, reports, etc.",
      "source_type": "official_api_docs",
      "accessed_at": "2026-07-13T12:00:00Z",
      "title": "Accounting API Accounts \u2014 Xero Developer"
    },
    "s8": {
      "url": "https://developer.xero.com/documentation/development-accounts",
      "quote": "Signing up for a Xero account is free. Use the demo company (recommended) or start a trial or paid Xero organisation subscription.",
      "source_type": "official_api_docs",
      "accessed_at": "2026-07-13T12:00:00Z",
      "title": "Development accounts \u2014 Xero Developer"
    },
    "s9": {
      "url": "https://satvasolutions.com/blog/xero-api-integration-guide",
      "quote": "Xero API base URLs: api.xero.com/api.xro/2.0/ (Accounting), assets.xro/1.0/, projects.xro/2.0/, payroll.xro/2.0/, files.xro/1.0/, bankfeeds.xro/1.0/. OAuth 2.0 required.",
      "source_type": "secondary_source",
      "accessed_at": "2026-07-13T12:00:00Z",
      "title": "Xero API Guide 2026: Endpoints, OAuth, Limits & Integration Tips"
    },
    "s10": {
      "url": "https://developer.xero.com/ai",
      "quote": "MCP Server \u2014 Securely and seamlessly connect LLMs to Xero data with our open source MCP server. Also CLI, Agentic SDK, Prompt Library.",
      "source_type": "official_product_page",
      "accessed_at": "2026-07-13T12:00:00Z",
      "title": "Xero's AI Toolkit \u2014 Xero Developer"
    }
  },
  "limitations": [
    "Some developer.xero.com pages timed out during fetch; used secondary sources and cached pages instead.",
    "The new API pricing model (Starter/Core/Plus/Advanced/Enterprise) took effect March 2, 2026, meaning the free tier is now limited to 5 connections and 1,000 API calls/day."
  ]
}