{
  "schema_version": "1.0",
  "app_id": "dataforseo",
  "researched_at": "2026-07-13T12:50:42Z",
  "research_run": {
    "agent": "initial_research_agent",
    "model": "deepseek-v4-flash",
    "tools": [
      "COMPOSIO_SEARCH_FETCH_URL_CONTENT",
      "COMPOSIO_SEARCH_TAVILY",
      "submit_app_research"
    ],
    "tool_calls": 13,
    "trace_path": "logs/dataforseo-trace.jsonl"
  },
  "findings": {
    "classification": {
      "researched_category": {
        "value": "SEO & Digital Marketing Data API",
        "evidence_ids": [
          "s1",
          "s2"
        ],
        "notes": "DataForSEO provides API access to SERP data, keyword metrics, backlinks, domain analytics, and other SEO/digital marketing data."
      },
      "one_liner": {
        "value": "API-first platform providing comprehensive SEO and digital marketing data including SERP results, keyword metrics, backlinks, domain analytics, and business listings.",
        "evidence_ids": [
          "s1",
          "s2"
        ]
      }
    },
    "authentication": {
      "methods": {
        "value": [
          "basic"
        ],
        "evidence_ids": [
          "s3"
        ],
        "notes": "Uses HTTP Basic Authentication with a login and an API password (auto-generated, distinct from account password). Credentials are Base64-encoded in the Authorization header."
      },
      "primary_for_agent_toolkit": "basic"
    },
    "access": {
      "credential_access": "self_serve_free",
      "gates": [
        "account_signup"
      ],
      "signup_friction": "none_observed",
      "paid_plan_required_for_api": "no",
      "admin_approval_required": "no",
      "evidence_ids": [
        "s5",
        "s6",
        "s7"
      ],
      "notes": "Anyone can sign up with a personal email on the register page. A free $1 credit is added upon registration for API testing. No phone verification, no waitlist, no admin gating. Higher rate limits are available with a Business account but the free tier is self-serve."
    },
    "api_surface": {
      "public_api": "yes",
      "protocols": [
        "rest",
        "webhooks"
      ],
      "breadth": "broad",
      "summary": {
        "value": "DataForSEO provides a comprehensive REST API (v3) covering SERP, Keywords Data, Backlinks, Domain Analytics, On-Page, DataForSEO Labs, Business Data, Merchant, App Data, Content Analysis, and AI Optimization APIs. It supports webhooks/callbacks, has an OpenAPI specification, and official client libraries for Python, PHP, C#, Java, and TypeScript. A LangChain wrapper is also available.",
        "evidence_ids": [
          "s4",
          "s8",
          "s9"
        ]
      },
      "api_docs_url": "https://docs.dataforseo.com/v3"
    },
    "agent_interface": {
      "mcp": "official",
      "mcp_endpoint": "https://github.com/dataforseo/mcp-server-typescript",
      "existing_agent_skills": [
        "official_sdk",
        "official_cli",
        "official_agent_api"
      ],
      "evidence_ids": [
        "s10",
        "s11",
        "s12"
      ],
      "notes": "DataForSEO has an official MCP server (TypeScript, Apache 2.0, 223 stars) with support for all major APIs. It can be run via npx, npm, Docker, or deployed as a Cloudflare Worker. Official setup guide and launch announcement exist. Also has a LangChain integration and official SDKs."
    },
    "buildability": {
      "verdict": "buildable_today",
      "main_blocker": "none_material",
      "rationale": {
        "value": "DataForSEO has a fully public REST API with comprehensive documentation, self-serve free signup with $1 trial credits (no phone/email restrictions), and an official MCP server that works with Claude, ChatGPT, Cursor, and other AI tools. There is no material blocker to building an agent toolkit today.",
        "evidence_ids": [
          "s1",
          "s3",
          "s5",
          "s10"
        ]
      }
    }
  },
  "sources": {
    "s1": {
      "url": "https://dataforseo.com",
      "quote": "We provide comprehensive SEO and digital marketing data solutions via API.",
      "source_type": "official_product_page",
      "accessed_at": "2026-07-13T12:00:00Z",
      "title": "DataForSEO: Powerful API Stack For Data-Driven SEO Tools",
      "retrieval_method": "composio_fetch"
    },
    "s2": {
      "url": "https://dataforseo.com/apis",
      "quote": "DataForSEO APIs \u2013 Powerful Data Solutions for SEO and SEM. All the data for your SEO tool in one place.",
      "source_type": "official_product_page",
      "accessed_at": "2026-07-13T12:00:00Z",
      "title": "DataForSEO APIs",
      "retrieval_method": "composio_fetch"
    },
    "s3": {
      "url": "https://docs.dataforseo.com/v3/auth",
      "quote": "DataForSEO is using the Basic Authentication, which makes it possible to call our APIs with almost any programming language... Instead of 'login' and 'password' use your credentials from https://app.dataforseo.com/api-access",
      "source_type": "official_auth_docs",
      "accessed_at": "2026-07-13T12:00:00Z",
      "title": "Authentication \u2013 DataForSEO API v.3",
      "retrieval_method": "composio_fetch"
    },
    "s4": {
      "url": "https://docs.dataforseo.com/v3",
      "quote": "DataForSEO API is using the REST technology for interchanging data between your application and our service.",
      "source_type": "official_api_docs",
      "accessed_at": "2026-07-13T12:00:00Z",
      "title": "DataForSEO API v.3",
      "retrieval_method": "composio_fetch"
    },
    "s5": {
      "url": "https://dataforseo.com/help-center/how-does-your-free-unlimited-trial-work",
      "quote": "To get a free trial, you should simply create an account with DataForSEO. Once you are logged into the DataForSEO Dashboard you\u2019ll see your API credentials... upon registration free $1 credit for API testing will be added to your account balance.",
      "source_type": "official_help_center",
      "accessed_at": "2026-07-13T12:00:00Z",
      "title": "How does your free unlimited trial work?",
      "retrieval_method": "composio_fetch"
    },
    "s6": {
      "url": "https://app.dataforseo.com/register",
      "quote": "Create your account. Personal email. $1 trial credits. No phone verification.",
      "source_type": "official_product_page",
      "accessed_at": "2026-07-13T12:00:00Z",
      "title": "DataForSEO - Register",
      "retrieval_method": "composio_fetch"
    },
    "s7": {
      "url": "https://dataforseo.com/pricing",
      "quote": "Note that the minimum payment amount is $50.",
      "source_type": "official_pricing",
      "accessed_at": "2026-07-13T12:00:00Z",
      "title": "DataForSEO API v3 Pricing",
      "retrieval_method": "composio_fetch"
    },
    "s8": {
      "url": "https://github.com/dataforseo/OpenApiDocumentation",
      "quote": "This repository contains a YAML file in OpenAPI format (version 3.x) that describes the current API of the DataForSeo API.",
      "source_type": "official_github",
      "accessed_at": "2026-07-13T12:00:00Z",
      "title": "dataforseo/OpenApiDocumentation",
      "retrieval_method": "composio_fetch"
    },
    "s9": {
      "url": "https://docs.dataforseo.com/v3",
      "quote": "YAML-formatted specification for all APIs. LangChain integration. DataForSEO API Wrapper.",
      "source_type": "official_api_docs",
      "accessed_at": "2026-07-13T12:00:00Z",
      "title": "DataForSEO API v.3",
      "retrieval_method": "composio_fetch"
    },
    "s10": {
      "url": "https://github.com/dataforseo/mcp-server-typescript",
      "quote": "Model Context Protocol (MCP) server implementation for DataForSEO, enabling AI assistants to interact with selected DataForSEO APIs and obtain SEO data through a standardized interface.",
      "source_type": "official_github",
      "accessed_at": "2026-07-13T12:00:00Z",
      "title": "dataforseo/mcp-server-typescript",
      "retrieval_method": "composio_fetch"
    },
    "s11": {
      "url": "https://dataforseo.com/help-center/setting-up-the-official-dataforseo-mcp-server-simple-guide",
      "quote": "DataForSEO MCP server is the implementation of the Model Context Protocol, allowing AI tools to obtain and process data from DataForSEO.",
      "source_type": "official_help_center",
      "accessed_at": "2026-07-13T12:00:00Z",
      "title": "Setting Up the Official DataForSEO MCP Server: Simple Guide",
      "retrieval_method": "composio_fetch"
    },
    "s12": {
      "url": "https://dataforseo.com/update/dataforseo-mcp-server-launch",
      "quote": "We\u2019re announcing the launch of the DataForSEO MCP Server, a cutting-edge solution that connects DataForSEO APIs with AI agents like Claude.",
      "source_type": "official_changelog",
      "accessed_at": "2026-07-13T12:00:00Z",
      "title": "DataForSEO MCP Server Launch: Connect APIs and AI Agents",
      "retrieval_method": "composio_fetch"
    }
  },
  "limitations": [
    "Could not find evidence of a specific Composio toolkit integration for DataForSEO; the existing agent interfaces (official MCP, LangChain, SDKs) are sufficient for building an agent toolkit."
  ]
}