{
  "schema_version": "1.0",
  "app_id": "gumroad",
  "researched_at": "2026-07-13T12:46:50Z",
  "research_run": {
    "agent": "initial_research_agent",
    "model": "deepseek-v4-flash",
    "tools": [
      "COMPOSIO_SEARCH_FETCH_URL_CONTENT",
      "COMPOSIO_SEARCH_TAVILY",
      "submit_app_research"
    ],
    "tool_calls": 14,
    "trace_path": "logs/gumroad-trace.jsonl"
  },
  "findings": {
    "classification": {
      "researched_category": {
        "value": "e-commerce / digital commerce platform",
        "evidence_ids": [
          "s1",
          "s2"
        ],
        "notes": "Gumroad is a platform for creators to sell digital products, memberships, and physical goods directly to customers."
      },
      "one_liner": {
        "value": "Digital commerce platform for creators to sell products, memberships, and digital goods directly to their audience.",
        "evidence_ids": [
          "s1",
          "s2"
        ]
      }
    },
    "authentication": {
      "methods": {
        "value": [
          "oauth2",
          "personal_access_token"
        ],
        "evidence_ids": [
          "s1",
          "3"
        ],
        "notes": "The API page describes OAuth 2.0 application registration but also provides 'Generate access token' for personal use. n8n docs confirm both methods."
      },
      "primary_for_agent_toolkit": "personal_access_token"
    },
    "access": {
      "credential_access": "self_serve_free",
      "gates": [
        "account_signup"
      ],
      "signup_friction": "none_observed",
      "paid_plan_required_for_api": "no",
      "admin_approval_required": "no",
      "evidence_ids": [
        "s1",
        "s2",
        "s9"
      ],
      "notes": "Gumroad pricing page shows no monthly fee (10% + $0.50 per transaction). Any free account can create an API application under Settings > Advanced. No paid plan or admin approval required."
    },
    "api_surface": {
      "public_api": "yes",
      "protocols": [
        "rest",
        "cli"
      ],
      "breadth": "moderate",
      "summary": {
        "value": "Gumroad v2 REST API at api.gumroad.com/v2 provides endpoints for Products (list/get/enable/disable), Sales (list/filter), Subscribers (list/get), Offer Codes (CRUD), License Keys (verify/enable/disable), Resource Subscriptions (webhooks), and User profile. Notably does NOT support creating products via API, and there is no official test/sandbox environment. The API page also documents a CLI wrapper. Some community references mention a conceptual GraphQL schema but official docs are REST-only.",
        "evidence_ids": [
          "s1",
          "s6",
          "s7"
        ]
      },
      "api_docs_url": "https://gumroad.com/api"
    },
    "agent_interface": {
      "mcp": "community",
      "mcp_endpoint": "https://github.com/rmarescu/gumroad-mcp",
      "existing_agent_skills": [
        "official_cli",
        "community_skill",
        "composio_toolkit"
      ],
      "evidence_ids": [
        "s5",
        "s4",
        "s8"
      ],
      "notes": "A community MCP server (rmarescu/gumroad-mcp) exists with 22+ stars, providing tools for products, sales, offer codes, and user data. Composio also has a Gumroad toolkit with 7 tools and OAuth2 support. Gumroad also provides an official CLI tool."
    },
    "buildability": {
      "verdict": "buildable_today",
      "main_blocker": "none_material",
      "rationale": {
        "value": "Gumroad has a well-documented public REST API, offers self-serve free API access (no paid plan or admin approval needed), and already has a community MCP server (rmarescu/gumroad-mcp) and Composio toolkit available. The API covers the main use cases an agent would need: listing products, querying sales, managing offer codes, verifying licenses, and subscribing to webhook events. The only notable gap is the lack of a 'create product' endpoint, which limits provisioning workflows but doesn't block most agentic use cases (analysis, monitoring, customer management).",
        "evidence_ids": [
          "s1",
          "s4",
          "s5",
          "s8"
        ]
      }
    }
  },
  "sources": {
    "s1": {
      "url": "https://gumroad.com/api",
      "quote": "The Gumroad OAuth API is based around REST. We return JSON for every request... On the application page, click Generate access token to get the token you will use with the API.",
      "source_type": "official_api_docs",
      "accessed_at": "2026-07-13T12:00:00Z",
      "title": "Gumroad API Documentation"
    },
    "s2": {
      "url": "https://gumroad.com/pricing",
      "quote": "Gumroad doesn't charge you a monthly fee. Instead, our fees are deducted as a small percentage of every sale.",
      "source_type": "official_pricing",
      "accessed_at": "2026-07-13T12:00:00Z",
      "title": "Gumroad Pricing"
    },
    "s3": {
      "url": "https://docs.n8n.io/integrations/builtin/credentials/gumroad",
      "quote": "Supported authentication methods: API access token, OAuth2",
      "source_type": "secondary_source",
      "accessed_at": "2026-07-13T12:00:00Z",
      "title": "Gumroad credentials - n8n Docs"
    },
    "s4": {
      "url": "https://composio.dev/toolkits/gumroad/",
      "quote": "Gumroad is a platform for selling digital products, physical goods, and memberships... Tools: 7... Managed auth: Managed by Composio",
      "source_type": "composio_catalogue",
      "accessed_at": "2026-07-13T12:00:00Z",
      "title": "Gumroad Toolkit - Composio"
    },
    "s5": {
      "url": "https://github.com/rmarescu/gumroad-mcp",
      "quote": "A Model Context Protocol (MCP) server implementation for Gumroad API",
      "source_type": "official_github",
      "accessed_at": "2026-07-13T12:00:00Z",
      "title": "rmarescu/gumroad-mcp on GitHub"
    },
    "s6": {
      "url": "https://stackoverflow.com/questions/70257679/how-can-one-create-a-product-through-gumroad-api",
      "quote": "I have been searching for a while and read the API documentation... not able to find any API endpoint which could allow me to create a product",
      "source_type": "secondary_source",
      "accessed_at": "2026-07-13T12:00:00Z",
      "title": "StackOverflow: How can one create a product through Gumroad API"
    },
    "s7": {
      "url": "https://rollout.com/integration-guides/gumroad/api-essentials",
      "quote": "API Features: View information about your products, Add, edit, and delete offer codes, variants, and custom fields... Subscribe to sales notifications, Verify licenses, Retrieve subscriber details",
      "source_type": "secondary_source",
      "accessed_at": "2026-07-13T12:00:00Z",
      "title": "Gumroad API Essential Guide - Rollout"
    },
    "s8": {
      "url": "https://mcp.so/server/gumroad-mcp/rmarescu",
      "quote": "Gumroad MCP Server is a Model Context Protocol (MCP) server implementation designed for Gumroad's API, allowing MCP-compatible AI clients to interact seamlessly with Gumroad's services.",
      "source_type": "secondary_source",
      "accessed_at": "2026-07-13T12:00:00Z",
      "title": "Gumroad MCP Server on MCP.so"
    },
    "s9": {
      "url": "https://gumroad.com/help/article/67-the-settings-menu.html",
      "quote": "Your advanced settings allow you to: ... Create an application to tap into Gumroad's API.",
      "source_type": "official_help_center",
      "accessed_at": "2026-07-13T12:00:00Z",
      "title": "Account settings - Gumroad Help Center"
    }
  },
  "limitations": [
    "The API does not support creating products (no POST /products endpoint)",
    "No official sandbox/test environment for development",
    "API docs are somewhat lacking in detail (no OpenAPI/Swagger spec)",
    "The API is primarily read-focused; write operations are limited to offer codes, variants, and custom fields"
  ]
}